The mitochondria is the powerhouse of the cell.,TF
List the different types of plastic surgery procedures.,SA
What is the water cycle?,SA
In economics state Gresham’s Law.,SA
Explain the basic operation of the CPU as it processes instructions in memory.,SA
Compare optic fibre and coaxial cable as data transmission media.,SA
Describe the operation of the CSMA/CD medium access protocol.,SA
Discuss the role of cache memory within the memory hierarchy.,SA
Name the three types of modulation which can be used to encode digital data on an analog wave.,SA
What is a short answer?,SA
You are looking at a dog with long hair. It is brown and white and short. Use the Dog Typing Strategy to choose an appropriate course of action to determine what type of dog it is with the given information.,SA
